{
  "$schema": "./palette.schema.json",
  "version": "0.1.0",
  "mercury": {
    "name": "Mercury",
    "emoji": "☿",
    "order": 0,
    "dark": false,
    "colors": {
      "rosewater": {
        "name": "Rosewater",
        "order": 0,
        "hex": "#c69493",
        "rgb": {
          "r": 198,
          "g": 148,
          "b": 147
        },
        "hsl": {
          "h": 1,
          "s": 31,
          "l": 68
        },
        "oklch": {
          "l": 0.714,
          "c": 0.06,
          "h": 20
        },
        "accent": true
      },
      "flamingo": {
        "name": "Flamingo",
        "order": 1,
        "hex": "#d18083",
        "rgb": {
          "r": 209,
          "g": 128,
          "b": 131
        },
        "hsl": {
          "h": 358,
          "s": 47,
          "l": 66
        },
        "oklch": {
          "l": 0.686,
          "c": 0.1,
          "h": 18
        },
        "accent": true
      },
      "pink": {
        "name": "Pink",
        "order": 2,
        "hex": "#ff67b3",
        "rgb": {
          "r": 255,
          "g": 103,
          "b": 179
        },
        "hsl": {
          "h": 330,
          "s": 100,
          "l": 70
        },
        "oklch": {
          "l": 0.726,
          "c": 0.199,
          "h": 352
        },
        "accent": true,
        "alias": "secondary"
      },
      "mauve": {
        "name": "Mauve",
        "order": 3,
        "hex": "#ff67b3",
        "rgb": {
          "r": 255,
          "g": 103,
          "b": 179
        },
        "hsl": {
          "h": 330,
          "s": 100,
          "l": 70
        },
        "oklch": {
          "l": 0.726,
          "c": 0.199,
          "h": 352
        },
        "accent": true
      },
      "red": {
        "name": "Red",
        "order": 4,
        "hex": "#c33355",
        "rgb": {
          "r": 195,
          "g": 51,
          "b": 85
        },
        "hsl": {
          "h": 346,
          "s": 58,
          "l": 48
        },
        "oklch": {
          "l": 0.55,
          "c": 0.18,
          "h": 12
        },
        "accent": true
      },
      "maroon": {
        "name": "Maroon",
        "order": 5,
        "hex": "#c16685",
        "rgb": {
          "r": 193,
          "g": 102,
          "b": 133
        },
        "hsl": {
          "h": 340,
          "s": 42,
          "l": 58
        },
        "oklch": {
          "l": 0.625,
          "c": 0.12,
          "h": 0
        },
        "accent": true
      },
      "peach": {
        "name": "Peach",
        "order": 6,
        "hex": "#e07f44",
        "rgb": {
          "r": 224,
          "g": 127,
          "b": 68
        },
        "hsl": {
          "h": 23,
          "s": 71,
          "l": 57
        },
        "oklch": {
          "l": 0.692,
          "c": 0.14,
          "h": 50
        },
        "accent": true
      },
      "yellow": {
        "name": "Yellow",
        "order": 7,
        "hex": "#c29e30",
        "rgb": {
          "r": 194,
          "g": 158,
          "b": 48
        },
        "hsl": {
          "h": 45,
          "s": 61,
          "l": 47
        },
        "oklch": {
          "l": 0.714,
          "c": 0.13,
          "h": 90
        },
        "accent": true
      },
      "green": {
        "name": "Green",
        "order": 8,
        "hex": "#00a070",
        "rgb": {
          "r": 0,
          "g": 160,
          "b": 112
        },
        "hsl": {
          "h": 162,
          "s": 100,
          "l": 31
        },
        "oklch": {
          "l": 0.625,
          "c": 0.135,
          "h": 163
        },
        "accent": true,
        "alias": "primary"
      },
      "teal": {
        "name": "Teal",
        "order": 9,
        "hex": "#11929d",
        "rgb": {
          "r": 17,
          "g": 146,
          "b": 157
        },
        "hsl": {
          "h": 185,
          "s": 81,
          "l": 34
        },
        "oklch": {
          "l": 0.602,
          "c": 0.1,
          "h": 205
        },
        "accent": true
      },
      "sky": {
        "name": "Sky",
        "order": 10,
        "hex": "#3fa8bf",
        "rgb": {
          "r": 63,
          "g": 168,
          "b": 191
        },
        "hsl": {
          "h": 191,
          "s": 50,
          "l": 50
        },
        "oklch": {
          "l": 0.682,
          "c": 0.1,
          "h": 215
        },
        "accent": true
      },
      "sapphire": {
        "name": "Sapphire",
        "order": 11,
        "hex": "#3199cd",
        "rgb": {
          "r": 49,
          "g": 153,
          "b": 205
        },
        "hsl": {
          "h": 200,
          "s": 61,
          "l": 50
        },
        "oklch": {
          "l": 0.648,
          "c": 0.12,
          "h": 235
        },
        "accent": true
      },
      "blue": {
        "name": "Blue",
        "order": 12,
        "hex": "#008779",
        "rgb": {
          "r": 0,
          "g": 135,
          "b": 121
        },
        "hsl": {
          "h": 174,
          "s": 100,
          "l": 26
        },
        "oklch": {
          "l": 0.559,
          "c": 0.1,
          "h": 182
        },
        "accent": true
      },
      "lavender": {
        "name": "Lavender",
        "order": 13,
        "hex": "#75a07d",
        "rgb": {
          "r": 117,
          "g": 160,
          "b": 125
        },
        "hsl": {
          "h": 131,
          "s": 19,
          "l": 54
        },
        "oklch": {
          "l": 0.664,
          "c": 0.07,
          "h": 150
        },
        "accent": true
      },
      "text": {
        "name": "Text",
        "order": 14,
        "hex": "#153434",
        "rgb": {
          "r": 21,
          "g": 52,
          "b": 52
        },
        "hsl": {
          "h": 181,
          "s": 43,
          "l": 14
        },
        "oklch": {
          "l": 0.3,
          "c": 0.037,
          "h": 197
        },
        "accent": false
      },
      "subtext1": {
        "name": "Subtext 1",
        "order": 15,
        "hex": "#2f4b4c",
        "rgb": {
          "r": 47,
          "g": 75,
          "b": 76
        },
        "hsl": {
          "h": 181,
          "s": 23,
          "l": 24
        },
        "oklch": {
          "l": 0.392,
          "c": 0.034,
          "h": 197
        },
        "accent": false
      },
      "subtext0": {
        "name": "Subtext 0",
        "order": 16,
        "hex": "#486161",
        "rgb": {
          "r": 72,
          "g": 97,
          "b": 97
        },
        "hsl": {
          "h": 181,
          "s": 14,
          "l": 33
        },
        "oklch": {
          "l": 0.472,
          "c": 0.029,
          "h": 197
        },
        "accent": false
      },
      "overlay2": {
        "name": "Overlay 2",
        "order": 17,
        "hex": "#657b7b",
        "rgb": {
          "r": 101,
          "g": 123,
          "b": 123
        },
        "hsl": {
          "h": 180,
          "s": 10,
          "l": 44
        },
        "oklch": {
          "l": 0.564,
          "c": 0.025,
          "h": 197
        },
        "accent": false
      },
      "overlay1": {
        "name": "Overlay 1",
        "order": 18,
        "hex": "#7e9192",
        "rgb": {
          "r": 126,
          "g": 145,
          "b": 146
        },
        "hsl": {
          "h": 180,
          "s": 8,
          "l": 53
        },
        "oklch": {
          "l": 0.643,
          "c": 0.022,
          "h": 197
        },
        "accent": false
      },
      "overlay0": {
        "name": "Overlay 0",
        "order": 19,
        "hex": "#97a9aa",
        "rgb": {
          "r": 151,
          "g": 169,
          "b": 170
        },
        "hsl": {
          "h": 180,
          "s": 10,
          "l": 63
        },
        "oklch": {
          "l": 0.722,
          "c": 0.02,
          "h": 197
        },
        "accent": false
      },
      "surface2": {
        "name": "Surface 2",
        "order": 20,
        "hex": "#afbebe",
        "rgb": {
          "r": 175,
          "g": 190,
          "b": 190
        },
        "hsl": {
          "h": 180,
          "s": 10,
          "l": 71
        },
        "oklch": {
          "l": 0.788,
          "c": 0.017,
          "h": 197
        },
        "accent": false
      },
      "surface1": {
        "name": "Surface 1",
        "order": 21,
        "hex": "#c2cece",
        "rgb": {
          "r": 194,
          "g": 206,
          "b": 206
        },
        "hsl": {
          "h": 180,
          "s": 11,
          "l": 78
        },
        "oklch": {
          "l": 0.841,
          "c": 0.013,
          "h": 197
        },
        "accent": false
      },
      "surface0": {
        "name": "Surface 0",
        "order": 22,
        "hex": "#d4dedf",
        "rgb": {
          "r": 212,
          "g": 222,
          "b": 223
        },
        "hsl": {
          "h": 180,
          "s": 14,
          "l": 85
        },
        "oklch": {
          "l": 0.894,
          "c": 0.012,
          "h": 197
        },
        "accent": false
      },
      "base": {
        "name": "Base",
        "order": 23,
        "hex": "#eef3f3",
        "rgb": {
          "r": 238,
          "g": 243,
          "b": 243
        },
        "hsl": {
          "h": 180,
          "s": 14,
          "l": 94
        },
        "oklch": {
          "l": 0.96,
          "c": 0.004,
          "h": 197
        },
        "accent": false
      },
      "mantle": {
        "name": "Mantle",
        "order": 24,
        "hex": "#e5ebeb",
        "rgb": {
          "r": 229,
          "g": 235,
          "b": 235
        },
        "hsl": {
          "h": 180,
          "s": 14,
          "l": 91
        },
        "oklch": {
          "l": 0.935,
          "c": 0.007,
          "h": 197
        },
        "accent": false
      },
      "crust": {
        "name": "Crust",
        "order": 25,
        "hex": "#dbe3e3",